French,English,GitHub Actions est tout ce qui gravite autour de la CI et la CD,GitHub Actions is everything that revolves around CI and CD
French,English,une licence qui est apposée sur le projet,a license that is affixed to the project
French,English,Donc si vous n'êtes pas à l'aise avec GitHub,So if you are not comfortable with GitHub
French,English,une entreprise qui propose des services d'hébergement,a company that offers hosting services
French,English,puisqu'en effet,since in fact
French,English,si vous souhaitez faciliter vos déploiements,if you want to make your deployments easier
French,English,le développement d'applications métier,the development of business applications
French,English,il est vivement recommandé de connaître préalable GitHub,It is strongly recommended to have prior knowledge of GitHub
French,English,Notez toutefois qu'afin d'aborder cette formation,Please note however that in order to approach this training
French,English,cela afin de fiabiliser vos projets,this in order to make your projects more reliable
French,English,la mise en place d'outils,the implementation of tools
English,Spanish,the quotation marks and the commas,las comillas y las comas
Spanish,English,dejamos comillas vacias,We leave empty quotes
Spanish,English,que les pertenezcan,that belong to them
Spanish,English,vamos a quitar los líneas que sobran,Let's remove the extra lines
Spanish,English,y cambiamos app por router,and we change app for router
Spanish,English,señala un error,indicates an error
Spanish,English,"esto, a su vez, permite que el proyecto sea más organizado","This, in turn, allows the project to be more organized."
Italian,English,"quindi, in ogni caso","so, in any case"
Italian,English,"quindi, ad esempio",so for example
Italian,English,ma è anche molto facile,but it's also very easy
Italian,English,dei concetti fondamentali di rete,of fundamental networking concepts
Italian,English,e infine,and finally
Italian,English,che tu conoscessi,that you knew
Italian,English,e alla fine del corso,and at the end of the course
Italian,English,e per questo motivo,and for this reason
Italian,English,per gli sviluppatori di React,for React developers
Italian,English,negli ultimi anni,in recent years
Spanish,English,puesto que podemos obtener metadatos,since we can get metadata
Spanish,English,en vez de definir el archivo,instead of defining the file
Spanish,English,entrega una código 404,delivers a 404 code
Spanish,English,el elemento asociado al archivo que se quiere subir,the element associated with the file you want to upload
Spanish,English,cuyo nombre será almacenado,whose name will be stored
Italian,English,servicio de almacenamiento,storage service
Spanish,English,puesto que lo que queremos ver es su funcionamiento,since what we want to see is how it works
Spanish,English,La función se va a llamar,The function is going to be called
Spanish,English,debemos esperar que la instrucción se cumple,we must wait for the instruction to be fulfilled
Spanish,English,puesto que la función solo retorna un diccionario,since the function only returns a dictionary
Spanish,English,otra puede estar siendo procesada al mismo tiempo,another may be being processed at the same time
Spanish,English,que a sido creada,that has been created
Spanish,English,y por ende,and therefore
Spanish,English,en el que se pone,in which it is placed
Spanish,English,que se encarga de crear los elementos,which is responsible for creating the elements
Spanish,English,que se encarga de crear,which is responsible for creating
Spanish,English,que se encarga,who is in charge
Spanish,English,para probar el modelo,to test the model
English,Italian,i have to go to the bathroom,devo andare in bagno
English,Spanish,i have to go to the bathroom,Tengo que ir al baño
Italian,English,regione,region
Italian,English,invito degli amici,Invite friends
Italian,English,occhi,eyes
Italian,English,que,what
Italian,English,questo,This
English,Spanish,for this reason,Por esta razón
Spanish,English,que hace parte del body,that is part of the body
Spanish,English,y los agregue a la lista de elementos,and add them to the list of items
Spanish,English,suelen recibir datos a través del body,They usually receive data through the body
Spanish,English,no siempre es requerido que la petición recibe un body,It is not always required that the request receives a body
Spanish,English,que nos entrega la petición,who delivers the request to us
Spanish,English,No deben ser entregadas por un endpoint,They should not be delivered by an endpoint
English,Spanish,five hundred,quinientos
Spanish,English,estos parámetros llegan como parte de la ruta,these parameters come as part of the route
Spanish,English,será como hubiéramos enviado un None,It will be as if we had sent a None
Spanish,English,si lo dejamos vacío,if we leave it empty
Spanish,English,sino que debemos escribirlo,but we must write it
Spanish,English,ya no nos salen opciones,We no longer have options
Spanish,English,que ya hayan sido completados,that have already been completed
Spanish,English,un valor asignado,an assigned value
Spanish,English,más adelante en este curso,later in this course
Spanish,English,ninguno de los dos cumple con el objetivo,Neither of them meets the objective
Spanish,English,ya que este endpoint,since this endpoint
Spanish,English,el endpoint permite el envío y el recepción de datos,The endpoint allows the sending and receiving of data
Spanish,English,se recomienda tener una estructura definida,It is recommended to have a defined structure
English,German,se recomienda tener una estructura definida,"Es wird empfohlen, eine definitive Struktur zu erstellen"
English,German,se recomienda tener una estructura definida,Wir empfehlen Ihnen eine definitive Struktur
Spanish,English,ya que esta documentación es interactiva,since this documentation is interactive
Spanish,English,en caso de haberlos,if there are
Spanish,English,se desplegará la information,the information will be displayed
Spanish,English,al darle clic a este recuadro,by clicking on this box
Spanish,English,seguido vemos la ruta del endpoint,Next we see the endpoint route
Spanish,English,"si le damos clic, abrirá el archivo","If we click on it, it will open the file"
Spanish,English,que apunta al archivo,which points to the file
Spanish,English,justo debajo del titulo encontramos una url,Just below the title we find a url
Spanish,English,primero nos encontramos con el nombre de la API,First we come across the API name
Italian,English,lo corremos ejecutando el comando,we ran it by executing the command
Italian,English,La solución que tenemos creada,The solution we have created
Italian,English,a medida que crece,as it grows
Italian,English,per i tuoi progetti Python,for your Python projects
Spanish,English,tiempo de espera agotado,timed out
Spanish,English,pero si la conexión fuera exitosa,but if the connection was successful
Spanish,English,tenemos el siguiente servidor,We have the following server
Spanish,English,se ve medio raro,It looks kind of weird
Spanish,English,nos han solicitado devolver por medio de un servicio la information de una clienta,We have been asked to return a client's information through a service
Italian,English,sciarpa,scarf
Italian,English,scintilla,spark
Italian,English,guanto,glove
Italian,English,cento,hundred
Italian,English,sono e sonno,I am and sleep
Italian,English,sete e sette,thirst and seven
Italian,English,segnale,signal
Italian,English,moglie,wife
Italian,English,figlio,son
Italian,English,aglio,garlic
English,Italian,i arrived,sono arrivato
English,Italian,we arrived,siamo arrivati
English,Italian,i have to go,devo andare
English,Italian,we have to go,dobbiamo andare
Spanish,English,recurso no encontrado,resource not found
Spanish,English,voy a irme a mi código,I'm going to go to my code
Spanish,English,si hubiera un error,If there was an error
Spanish,English,cada solicitud que llegue a la ruta,each request that arrives on the route
Spanish,English,luego de esto,after this
Spanish,English,lo primero que vamos hacer es,The first thing we are going to do is
English,Spanish,i dont know enough words,No sé suficientes palabras
English,Spanish,to start,Para empezar
English,Spanish,my company,Mi empresa
English,Spanish,"whats going on, how was your trip",¿Qué pasa? ¿Cómo estuvo tu viaje?
Spanish,English,"sumar, restar y multiplicar","add, subtract and multiply"
Spanish,English,sabes algo al respecto,do you know anything about it
English,Spanish,you can lie about it later,Puedes mentir sobre ello más tarde
Spanish,English,hagamos la prueba,let's do the test
Spanish,English,Vemos cómo podemos crear un servidor web,We look at how we can create a web server
Spanish,English,un framework web de alto rendimiento,a high performance web framework
Spanish,English,él permite formatear la salida con sangrías,It allows you to format the output with indents
Spanish,English,que pasa,what's happening
English,Spanish,we turned too early,"Nosotras giramos demasiado temprano
Nosotros giramos demasiado temprano"
English,Spanish,all of the colleagues,Todos los colegas
English,Spanish,I have a company party from Thursday to Saturday,Tengo una fiesta de empresa de jueves a sábado.
Spanish,English,enviamos la consulta,we send the query
Spanish,English,vamos a irnos al código,let's go to the code
Spanish,English,la información que venga en esta parámetro,the information that comes in this parameter
Spanish,English,después del signo de pregunta,after the question mark
English,Spanish,i hope someone can understand me,Espero que alguien pueda entenderme
English,Spanish,i bought the book after tou recomended it,Compré el libro después de que lo recomendaste.
Spanish,English,alto rendimiento,high performance
Spanish,English,no te pierdas la oportunidad de llevar tus habilidades al siguiente nivel,Don't miss the opportunity to take your skills to the next level
Spanish,English,no te pierdas la oportunidad,Don't miss the opportunity
Spanish,English,cada %v va a ser sustituido por un valor de nuestro mapa,Each %v will be replaced by a value from our map
Spanish,English,y nuestro deseo es lo convertirlo en un string,and our wish is to turn it into a string
Spanish,English,divididos en cinco grupos separados por guiones,divided into five groups separated by dashes
Spanish,English,vamos a recorrer el slice por medio de un for,We are going to go through the slice using a for loop.
Spanish,English,por lo que deseamos lo eliminar del slice,so we want to remove it from the slice
Spanish,English,"sin embargo, nos dimos cuenta que el día jueves es feriado","However, we realized that Thursday is a holiday."
Spanish,English,y le doy clic en Enviar,and I click on Send
Spanish,English,me aseguro que sea un método POST,I make sure it is a POST method
Spanish,English,vamos a setear el header,Let's set the header
Spanish,English,donde indicamos que hubo un error,where we indicate that there was an error
Spanish,English,por medio de un error,by means of an error
Spanish,English,pero si todo es exitoso,But if everything is successful
Spanish,English,en caso de que existiera un error,in case there was an error
Spanish,English,esto nos ayuda a desempaquetar los elementos,This helps us unpack the elements
English,Spanish,to check if we saved the file,para comprobar si guardamos el archivo
Spanish,English,caso contrario vamos a indicar que no existe,Otherwise we will indicate that it does not exist
Spanish,English,caso contrario,otherwise
Spanish,English,y entre paréntesis cuadrados,and in square brackets
Spanish,English,veamos en el caso de React,Let's see in the case of React
Spanish,English,tiene asociada un nombre,has a name associated with it
Spanish,English,dos numeros enteros,two integers
English,Spanish,What we are going to do is place an if-statement here.,Lo que vamos a hacer es colocar una declaración if aquí.
Spanish,English,el apellido,the last name
Spanish,English,Tal vez no recordemos el nombre,We may not remember the name
Spanish,English,por tu cuenta o con tu equipo de trabajo,on your own or with your work team
Spanish,English,ahora ya cuentas con un repositorio listo,Now you have a repository ready
Spanish,English,como vimos previamente,As we saw previously
Spanish,English,esta aplicación como tal,This application as such
Spanish,English,entrelazada,intertwined
Spanish,English,pero puedes darte cuenta como,but you can see how
Spanish,English,se requiere mantener un control,It is required to maintain control
Spanish,English,esto toma más coherencia,This makes more sense
Spanish,English,le restamos 1,we subtract 1
Spanish,English,hagamos eso,let's do that
Spanish,English,lo podemos hacer por medio del índice,We can do it through the index
Spanish,English,dado que esta será al que se le entregue el premio,since this will be the one to whom the prize will be awarded
Spanish,English,nos hemos dado cuenta que hubo un error,We have realized that there was a mistake
Spanish,English,nos hemos dado cuenta que,We have realized that
Spanish,English,los números ganadores de una rifa,the winning numbers of a raffle
Spanish,English,cuando desconozcas la cantidad de argumentos,when you don't know the amount of arguments
Spanish,English,para recorrer este arreglo de string,to loop through this string array
Spanish,English,voy a guiarte a través de todo,I'll guide you through everything
Spanish,English,en el costado,on the side
Spanish,English,"por ahora, tenga encuenta que","For now, please note that"
Spanish,English,como punto de partida,as a starting point
Spanish,English,por que haríamos eso,why would we do that
Spanish,English,Eso suena un poco raro,That sounds a little strange
Spanish,English,que te guiará a través de un tutorial sencillo,that will guide you through a simple tutorial
Spanish,English,tu nombre y apellido,your name and surname
Spanish,English,"una vez que hayas creado tu cuenta, haz lo siguiente","Once you have created your account, do the following"
Spanish,English,así que si estás listo,so if you are ready
Spanish,English,a medida que tu sitio crece,as your site grows
Spanish,English,crea tu propio trabajo desde cero,create your own work from scratch
Spanish,English,en caso de que pase,in case it happens
Spanish,English,esto se debe a que puede ser posible que la cadena no sea un número válido.,This is because it may be possible that the string is not a valid number.
Spanish,English,eso se puede hacer para que los datos sean compatibles,This can be done to make the data compatible
Spanish,English,vamos a darle Enter,Let's hit Enter
Spanish,English,las comillas dobles,double quotes
Spanish,English,Colocamos un backtick adelante y al final,We place a backtick in front and at the end
Spanish,English,hemos logrado nuestro objetivo,We have achieved our goal
Spanish,English,como parte de la tarea,as part of the task
Spanish,English,en el asunto tenemos,In the matter we have
Spanish,English,nos han solicitado enviar un correo electrónico,We have been asked to send an email
Spanish,English,la solución desafíos comunes,the solution to common challenges
Spanish,English,aunque quizás te hayas encontrado con retos,Although you may have encountered challenges
Spanish,English,te surgen dudas,You have doubts
Spanish,English,te ha pasado que mientras estás programando,Has it happened to you that while you are programming
Spanish,English,GitLab nos proporciona algunas variables,GitLab provides us with some variables
Spanish,English,cómo podemos hacer para ver todos los mensajes,How can we see all the messages?
Spanish,English,ya que la gorutina podría no tener tiempo suficiente,since the goroutine might not have enough time
Spanish,English,la palabra clave go,the keyword go
Spanish,English,para realizar tareas en segundo plano,to perform tasks in the background
Spanish,English,en segundo plano,in the background
Spanish,English,en un solo hilo de ejecución,in a single thread of execution
Spanish,English,así que echemos un vistazo al archivo readme,So let's take a look at the readme file
Spanish,English,algo muy común que se puede hacer,a very common thing to do
Spanish,English,compruébalo,Check it out
Spanish,English,seguridad y almacenamiento,security and storage
Spanish,English,queremos agregar autenticación,We want to add authentication
English,Spanish,i try to speak as much as I can,Intento hablar lo más que puedo
Spanish,English,combiémoslo a no,Let's change it to no
Spanish,English,por lo que debemos proporcionar ese nombre,so we need to provide that name
Spanish,English,qué se trata esta función y qué hace,what this function is about and what it does
Spanish,English,me gusta esa estandár porque,I like that standard because
Spanish,English,así es como lo hace,this is how you do it
Spanish,English,déjeme guardarlo,let me save it
Spanish,English,explicártelo un poco más adelante,explain it to you a little later
Spanish,English,para lo cual necesitaremos,for which we will need
Spanish,English,pero basta de teoría,But enough of theory
Spanish,English,si pulsas en el botón,If you click on the button
Spanish,English,teniendo todo bajo un mismo techo,having everything under one roof
Spanish,English,fomentar el reùso de componentes,promote the reuse of components
English,Spanish,This makes more sense,Esto tiene más sentido
Spanish,English,de allí el nombre,hence the name
Spanish,English,un conjunto de herramientas,a set of tools
Spanish,English,y lleva tus habilidades con React,and take your React skills to the next level
Spanish,English,entregar código robusto con mejor calidad,deliver robust code with higher quality
Spanish,English,te guiaré en la configuración,I will guide you through the setup
Spanish,English,que te ayudará a ahorrar tiempo,that will help you save time
Spanish,English,probar tu aplicación,Test your app
Spanish,English,aunque también podemos echar mano de algunos patrones de diseño,although we can also make use of some design patterns
Spanish,English,muy cerca de llegar al final,very close to reaching the end
Spanish,English,dónde se va a encontrar,where will you find it
Spanish,English,en el moment en que dejemos de utilizar este hook,the moment we stop using this hook
Spanish,English,a partir de eso momento vamos a seguir escuchando,From that moment on we will continue listening
Spanish,English,ya lo tenemos habilitado,We already have it enabled
Spanish,English,no está disponible aún,not available yet
Spanish,English,o sea,that is
Spanish,English,para ahorrarnos posibles problems,to save us possible problems
Spanish,English,"si no, te puede dar problemas","If not, it may cause you problems."
Spanish,English,yo probé dentro de Google Chrome,I tried it inside Google Chrome
Spanish,English,hacia arriba y hacia abajo,upward and downward
Spanish,English,cada vez que se mueva el mouse,every time the mouse moves
Spanish,English,lo que voy a necesitar es,What I'm going to need is
Spanish,English,lo voy a dejar el vacío,I'm going to leave it empty
Spanish,English,Voy a dejar el vacío,I'm going to leave the void
English,Spanish,I'm going to take advantage of the situation,Voy a aprovechar la situación.
Spanish,English,cuenta como una función de React,counts as a React function
Spanish,English,todavía se encuentran en un punto muy basico,They are still at a very basic point
Spanish,English,el cual está basado en este otro componente,which is based on this other component
Spanish,English,Te estoy mostrando,I'm showing you
English,Spanish,We no longer need to think so much about it,Ya no necesitamos pensar tanto en eso
Spanish,English,y lo estoy vinculando para que se ejecute este método,and I'm binding it so that this method runs
Spanish,English,y eso es todo,and that's all
Spanish,English,y lo traigo a mi componente funcional,and I bring it to my functional component
Spanish,English,esto nos va a funcionar,This is going to work for us
Spanish,English,"si te fijas, como te estaba mencionando","If you notice, as I was mentioning to you"
English,Spanish,we are going to completely ignore this part,Vamos a ignorar por completo esta parte.
Spanish,English,analicemos la parte del constructor,Let's analyze the constructor part
Spanish,English,aún nos faltan algunos partes,We are still missing some parts
Spanish,English,en teoria,in theory
Spanish,English,que vuelve mucho más fáciles estos procesos,which makes these processes much easier
Spanish,English,vayamos viendo las grandes ventajas que tiene,Let's see the great advantages it has
Spanish,English,por las cuales se crearon los hooks,for which hooks were created
Spanish,English,por las cuales se crearon,for which they were created
Spanish,English,yo no hiciera esto,I wouldn't do this
Spanish,English,si nos fijamos acá,If we look here
Spanish,English,otro detalle importante es que,Another important detail is that
Spanish,English,dentro del resto de la aplicación,within the rest of the application
English,Spanish,inheritance is a concept of object-oriented programming,La herencia es un concepto de programación orientada a objetos.
Spanish,English,desplegarla dentro del documento,display it within the document
Spanish,English,yo voy a venir acá,I'm going to come here
Spanish,English,"así que, por ejemplo",So for example
Spanish,English,y nos la está refiriendo a este método que está acá,and he is referring us to this method that is here
Spanish,English,está tomando el alcance de esta clase,is taking the scope of this class
Spanish,English,aún no existe este método,This method does not exist yet
Spanish,English,rastrear cuál fue el input,trace what the input was
Spanish,English,es una cadena de texto vacía,is an empty text string
Spanish,English,así que vamos a poner manos a la obra,So let's get to work
Spanish,English,así que vamos a poner manos,So let's get down to business
Spanish,English,según la selección que aparece acá,according to the selection that appears here
Spanish,English,el manejo del estado,state management
Spanish,English,y vemos que se va a mostrar,and we see what is going to be shown
Spanish,English,además de eso,besides that
Spanish,English,fuga de memoria,memory leak
Spanish,English,tengo que presionar clic derecho,I have to press right click
Spanish,English,depurar,debug
Spanish,English,ya se encuentra todo listo,Everything is ready now
Spanish,English,te voy a mostrar un par rápidamente,I'll show you a couple quickly
Spanish,English,calza con el nombre,fits the name
Spanish,English,y acá buscar,and search here
English,Spanish,I am proud,"Estoy orgullosa
Estoy orgulloso"
English,Spanish,i answered it correctly,Lo respondí correctamente
English,Spanish,the most important verbs,Los verbos más importantes
English,Spanish,i can talk the whole day,Puedo hablar todo el día
Spanish,English,el modo de depuración,debug mode
Spanish,English,en caso de que no,in case you don't
Spanish,English,tienes que arrastrar esa carpeta,you have to drag that folder
Spanish,English,abordar los problemas,address the problems
Spanish,English,poder traer la funcionalidad a los hooks,to be able to bring functionality to hooks
Spanish,English,el concepto que está detrás de los hooks,the concept behind hooks
Spanish,English,tal como su nombre el dice,Just as his name says
Spanish,English,lo mismo ocurre con los eventos,The same goes for events
Spanish,English,lo reemplazamos por una solo línea,We replace it with a single line
Spanish,English,muy parecidas,very similar
Spanish,English,que te estoy mostrando acá,what I'm showing you here
Spanish,English,antes de comenzar quisiera hablarte sobre qué son,Before starting I would like to talk to you about what they are
Spanish,English,"Será un gusto ser tu instructora
Será un gusto ser tu instructor","It will be a pleasure to be your instructor
It will be a pleasure to be your instructor"
Spanish,English,a depurar y prevenir posibles errores,to debug and prevent possible errors
Spanish,English,dejar de usar patrones innecesariamente,stop using patterns unnecessarily
English,Spanish,now let's move onto the terminal,Ahora pasemos a la terminal.
Spanish,English,es bastante parecida a esta herramientas,It is quite similar to this tool
Spanish,English,que provee GitLab,that GitLab provides
Spanish,English,la responsabilidad de cada una de ellas,the responsibility of each of them
Spanish,English,de cada una de ellas,of each of them
Spanish,English,y ver dónde se producen los cambios,and see where the changes occur
Spanish,English,lo primero que nos puede venir a la cabeza,the first thing that may come to mind
Spanish,English,que al princípio serán un poco una locura,that at first will be a bit crazy
Spanish,English,un montón de ramas,a bunch of branches
Spanish,English,vais a llegar a este tipo de dibujos,You will get to this kind of drawings
Spanish,English,cualquier persona que tuviera todavía un repositorio descargado,anyone who still had a downloaded repository
Spanish,English,en caso de que se perdiera el servidor,in case the server was lost
Spanish,English,Para subirlas luego más tarde,To upload them later
English,Spanish,the windows and the advantages,Las ventanas y las ventajas
English,Spanish,windows and advantages,ventanas y ventajas
Spanish,English,est tiene ciertas ventajas,This has certain advantages
Spanish,English,de tal manera que,in such a way that
Spanish,English,si el servidor se cae,If the server goes down
Spanish,English,Los problemas de rendimiento,Performance issues
Spanish,English,podías ir adelante y atrás,you could go forward and backward
