English,French,that I already have,que j'ai déjà
English,French,throughout the week,tout au long de la semaine
English,French,I can record phrases,Je peux enregistrer des phrases
English,French,to keep them apart in your head,pour les garder séparés dans ta tête
English,French,italian and spanish,italien et espagnol
English,French,the are lenient,ils sont indulgents
English,French,in the middle,au milieu
English,French,when i did that,quand j'ai fait ça
English,French,i think i can remember that,je crois que je peux m'en souvenir
English,French,to read aloud,lire à haute voix
English,French,I ate too much,J'ai trop mangé
English,French,it will work,ça marchera
English,French,i have the feeling that,j'ai le sentiment que
English,French,I forgot the word,J'ai oublié le mot
English,French,who are overweight,qui sont en surpoids
English,French,i can enjoy my breakfast now,je peux profiter de mon petit-déjeuner maintenant
English,French,a bit earlier,un peu plus tôt
English,French,street lights,lampadaires
English,French,a bit crazy,un peu fou
English,French,i would go to bed,j'irais me coucher
English,French,these stairs are fun,ces escaliers sont amusants
English,French,i will get in the train,je vais monter dans le train
English,French,I'm sitting in a restaurant,Je suis assis dans un restaurant
English,French,the man behind the bar,l'homme derrière le bar
English,French,but I don't want to look it up now,mais je ne veux pas le chercher maintenant
English,French,because they were dirty,parce qu'ils étaient sales
English,French,my hands were dirty,mes mains étaient sales
Italian,French,accanto,près de
Italian,English,non racconti una barzelletta,you're not telling a joke
French,English,c'est en partie,it is partly
French,English,sauf que ici,except that here
French,English,autant,as much
French,English,sans pour autant avoir,without having
French,English,par rapport,compared with
French,English,atouts,assets
Spanish,English,subidas,uploads
Spanish,English,ha tomado mucha importancia,has taken on great importance
Spanish,English,aplicaciones de escritorio,desktop applications
Spanish,English,esfuerzos en paralelo para hacer,parallel efforts to make
Spanish,English,todos estos hitos han supuesto que,All these milestones have meant that
Spanish,English,desveló su proyecto,unveiled his project
Spanish,English,darse cuenta de los problemas,realize the problems
Spanish,English,diseñado para,designed for
Spanish,English,le dio soporte oficial,gave official support
Spanish,English,un gran medida,a large extent
Spanish,English,que te evitará repetitivo,that will prevent you from being repetitive
French,English,que te evitará,that you will avoid
French,English,par rapport à,compared to
French,English,sous le capot,under the hood
French,English,on va voir esemble après à quoi il ressemble,we will see together afterwards what it looks like
French,English,on va aussi rappeler un point,we will also remind you of a point
French,English,va du coup nous forcer,will suddenly force us
French,English,c'est assez incroyable d'avoir ça,It's pretty amazing to have that
French,English,sans pour autant avoir,without necessarily having
French,English,un des plus grands atouts,one of the greatest assets
French,English,pour effectuer des tris,to carry out sorting
French,English,on va le voir par la suite,we will see it later
French,English,engendrer de coût,incur costs
French,English,ainsi que la gestion,as well as management
French,English,fortement typé,strongly typed
French,English,donc il essaye de pallier,so he tries to compensate
French,English,dues à son historique,due to its history
French,English,c'est en partie aussi pour,It is partly also for
French,English,ils ont ensuite pris la décision,They then made the decision
French,English,pour pallier ça,to overcome this
French,English,des soucis sur la sécurité mémoire,concerns about memory security
French,English,dus à des comportements indéfinis,due to undefined behaviors
French,English,ce que ça induit d'utiliser,what it means to use
French,English,"c'est censé être acquis, connu au préalable","it is supposed to be acquired, known in advance"
French,English,mais pour autant,but for all that
French,English,de vous expliquer à quoi cela sert,to explain to you what it is for
French,English,je pars du principe que,I assume that
French,English,ça devrais être déjà acquis,it should already be acquired
French,English,il faudrait avoir déjà utilisé,you should have already used
French,English,Aborder les prérequis,Address the prerequisites
German,English,des weiteren kannst du,"Furthermore, you can"
German,English,eine Aufstellung der wichtigsten Programme,a list of the most important programs
German,English,für ihre Zwecke einspannen,to use for their own purposes
German,English,mir schwirrt der Kopf,my head is spinning
German,English,man trifft sie aber in der freien Wildbahn immer seltener an,but they are increasingly rare in the wild
German,English,nicht so trivial wie es zunächst klingt,not as trivial as it sounds at first
German,English,das steigert die Übersicht,this improves the overview
German,English,mit Anderen Worten,in other words
German,English,das artet schnell in Arbeit aus,this quickly turns into work
German,English,Hinweise auf möglichen Stolperfallen,Information on possible pitfalls
German,English,das Training richtet sich an,The training is aimed at
Spanish,English,no devuelve ningún tipo de salida,does not return any type of output
Spanish,English,así como el nombre,as well as the name
Spanish,English,un salto de linea,a line break
Spanish,English,you los voy a separar por saltos de líneas,I'm going to separate them by line breaks.
Spanish,English,estas son dos formas con las que puedes usar comandos,These are two ways you can use commands
Spanish,English,ahora mismo,right now
Spanish,English,a continuación vamos a aprender,Next we are going to learn
Spanish,English,lenguajes mejor pagados,highest-paid languages
French,English,on va revenir dessus un peu plus tard,we'll come back to this a little later
French,English,par rapport à sa taille,in relation to its size
French,English,et ainsi de suite,and so on
French,English,autant que je veux,as much as I want
French,English,combien de roues aura ma voiture,how many wheels will my car have
French,English,étant donné aue les pojets,given that the projects
French,English,au niveau de l'entretien du programme,at the program maintenance level
French,English,pareil pour le panier,same for the basket
French,English,de ce fait,for this reason
French,English,dans le cadre d'une application,as part of an application
French,English,donc de haut en bas,so from top to bottom
French,English,"en gros, une procédure",basically a procedure
French,English,qui va s'appuyer sur des procédures,which will rely on procedures
French,English,VSCode va se lancer,VSCode will launch
French,English,suite à l'installation de VSCode,following the installation of VSCode
French,English,je vais laisser coché,I will leave it checked
French,English,je n'ai plus qu'à attendre,I just have to wait
French,English,c'est parti,here we go
French,English,de vous en sortir largement,to get by easily
English,French,variable assignments,affectations de variables
French,English,aussi bien à des débutants,as well as for beginners
French,English,à relever le challenge,to take up the challenge
French,English,avec de la mise en pratique,with practical application
French,English,de façon approfondie,in depth
French,English,tu es dans un bon endroit,you are in a good place
Polish,English,poza kodem,outside the code
Polish,English,a potem mogę,and then I can
Polish,English,wieć napiszemy do konsoli,so we'll write to the console
Polish,English,a potem,and then
Italian,English,se vai alla casella di ricerca qui,if you go to the search box here
Italian,English,quindi digiterò dotnet,so I'll type dotnet
Polish,English,"wszystko, co musisz zrobić",all you have to do
Polish,English,Możesz więc pracować,So you can work
Polish,English,na swoim komputerze,on your computer
Polish,English,do menu kod,to the menu code
Polish,English,jest to dość łatwe,it's quite easy
Polish,English,jeśli chcesz pobrać,if you want to download
Polish,English,treść kursu jest,the course content is
Polish,English,kilka,several
Polish,English,nie musisz być ekspertem,you don't have to be an expert
Polish,English,dla programistów,for programmers
Italian,English,una volta fatto questo,once this is done
Italian,English,e tra l'altro la parola è nuova,and by the way the word is new
Italian,English,un rapida rassegna di alcuni dei termini,a quick review of some of the terms
Italian,English,man mano che i programmi diventano più complessi,as programs become more complex
English,Dutch,regardless of whether your answer is correct,ongeacht of uw antwoord juist is
Dutch,English,een korte uitleg geven over hoe deze fetchData() functie werkt,give a brief explanation of how this fetchData() function works
Dutch,English,afhankelijk van de iutdaging,depending on the challenge
Dutch,English,ik ga ervan uit dat je,I assume you
English,Dutch,I suggest that you use VSCode,Ik raad je aan om VSCode te gebruiken
Dutch,English,nauw te integreren,to integrate closely
Dutch,English,we zullen ook zien hoe,we will also see how
Dutch,English,"georganiseerd, uitbreidbaar en gemakkelijk","organized, expandable and easy"
Dutch,English,maar naarmate je projecten groter worden,but as your projects get bigger
English,Italian,for this to work,perché questo funzioni
Italian,English,la priorità deve essere da zero a cinque,priority must be from zero to five
Italian,English,"quindi, in tal caso","so, in that case"
Italian,English,si noti che,Please note that
Italian,English,ho selezionato una raccolta,I selected a collection
Italian,English,ognuna di queste cartelle,each of these folders
Italian,English,li ho messi qui,I put them here
English,Italian,and so on,e così via
Italian,English,siamo partiti alle grande,we got off to a great start
Italian,English,ma in poche parole,but in a nutshell
English,Italian,the arguments are optional,gli argomenti sono facoltativi
Italian,English,Prova ad avviare una sessione,Try starting a session
Italian,English,se ce ne sono due,if there are two
Italian,English,cadenti,falling
Italian,French,fa l'attore,est l'acteur
Italian,French,viviamo in giro,Nous vivons autour
English,Dutch,they are called laces,ze heten veters
English,Polish,fifteen,piętnaście
English,Polish,two thousand twenty five,dwa tysiące dwadzieścia pięć
English,Dutch,I'm eating breakfast in the evening,Ik eet 's avonds ontbijt
Polish,English,"zdrowych wesołych świąt wielkanocnych, do zobaczenia","healthy and happy Easter, see you soon"
Italian,French,fra poco,bientôt
Italian,French,attori,acteurs
Italian,French,zaini,sacs à dos
Italian,French,attrici,actrices
Spanish,English,sigamos viendo,let's keep watching
Spanish,English,"asimismo, podemos utilizar caracteres","Likewise, we can use characters"
Spanish,English,la marca de tiempo,the timestamp
Spanish,English,si la dejamos en blanco,if we leave it blank
Spanish,English,muestra la marca de tiempo,displays the timestamp
Spanish,English,cuando solicitamos datos,when we request data
Spanish,English,para subir de nivel,to level up
Spanish,English,el ahorro en líneas de código,saving lines of code
Spanish,English,esto quiere decir que,This means that
Spanish,English,se va a retrasar hasta que su valor sea requerido,will be delayed until its value is required
Spanish,English,nuestra fuente de datos,our data source
Spanish,English,una manera sumamente reducida,an extremely reduced manner
Spanish,English,reviso si la longitud es mayor que seis,I check if the length is greater than six
Spanish,English,qué fue lo que hice,what did I do
Spanish,English,"con un ciclo ""for""","with a ""for"" loop"
Spanish,English,para poder conocer más acerca de,to be able to know more about
Spanish,English,por medio de practicas y ejercicios,through practices and exercises
Spanish,English,Hoy en día,Nowadays
Spanish,English,coincidencias de patrones,pattern matching
Spanish,English,profundizaremos en cada tema,We will go deeper into each topic
Spanish,English,iremos más allá,we will go further
Italian,English,ho preso uno spavento,I got a scare
Italian,English,mi mandi la fattura,send me the invoice
Italian,English,si richiede,it is required
Italian,English,amicizia,friendship
Italian,English,fisse,fixed
Italian,English,proprio sotto casa,right under the house
Italian,English,mezzo,half
Italian,English,legno,wood
Italian,English,ci andiamo,we're going there
Italian,English,palestra,gym
Italian,English,palesta,gym
Italian,English,come negli esempi,as in the examples
Italian,English,mancanti,missing
Italian,English,vezzeggiativo,pet name
Italian,English,spesso,Often
Italian,English,suocero,father in law
Italian,English,nuora,daughter in law
Italian,English,genero,son in law
Italian,English,cognato,brother in law
Italian,English,nipote,Grandchild
Italian,English,insegnante bravo,good teacher
English,Italian,an interesting lesson,una lezione interessante
Italian,English,apertuvo,I opened
Italian,English,amaro,bitter
Italian,English,uovo in camicia,poached egg
Italian,English,antipasto misto,mixed appetizer
Italian,English,ora ed adesso,now and now
Italian,French,soggiorno,rester
Italian,English,soggiorno,stay
Italian,English,ricercatore,researcher
Italian,English,numero dispari,odd number
Italian,English,cerchio intorno,circle around
Italian,English,ma comunque,but anyway
English,Italian,do you know yet which day would work for you for a bike excursion?,Sai già quale giorno è più adatto a te per un'escursione in bicicletta?
English,Italian,it is a word that I didn't know when I was in Milano,è una parola che non conoscevo quando ero a Milano
Italian,French,improvvisamente,soudainement
Italian,French,uccelli volano e cantano,les oiseaux volent et chantent
Italian,French,sulla destra,sur la droite
Italian,French,parcheggiano,ils se garent
Italian,French,la buia città,la ville sombre
Italian,French,attraversano,ils traversent
Italian,French,fianco,flanc
Italian,French,di solito,Habituellement
Italian,French,di solito,Généralement
Italian,English,di solito,Usually
English,Italian,i have to brush my teeth,devo lavarmi i denti
English,Italian,and now,e adesso
English,Italian,im not in a hurry,non ho fretta
English,Italian,that's all,è tutto
English,Italian,"I was at the airport in 7 minutes, the taxi was a good tip","Ero all'aeroporto in 7 minuti, il taxi è stato un buon consiglio"
English,Italian,"Good morning, Alex, I am in a taxi, keys are in box","Buongiorno Alex, sono in taxi, le chiavi sono nella scatola"
English,Italian,"yes, i can open and close the box","sì, posso aprire e chiudere la scatola"
Italian,English,Se riesco passo prima che vada a dormire,"If I can, I'll come by before I go to sleep."
English,Italian,"That makes sense. I forgot, you actually live very close to the airport, and without the noise.","Ha senso. Ho dimenticato, in realtà vivi molto vicino all'aeroporto, e senza il rumore."
English,Italian,milk coffee,caffè latte
English,Italian,and there I want to find a cafe,e lì voglio trovare un caffè
English,Italian,I want to go to the place we will meet,Voglio andare nel posto dove ci incontreremo
English,Italian,i would like to buy a ticket,vorrei comprare un biglietto
English,Italian,i would like to buy a ticket,vorrei acquistare un biglietto
English,Italian,i 2ould like to buy,vorrei comprare
English,Italian,I am from Berlin,Io sono di Berlino
English,Italian,I just asked her and she said yes,Gliel'ho appena chiesto e lei ha detto di sì
English,Italian,Is this the platform for the train to Bergamo at 8:40,È questo il binario del treno per Bergamo delle 8:40
English,Italian,Now I want to take the train at 8:40,Adesso voglio prendere il treno delle 8:40
English,Italian,"You have to always look at the live times, not the paper schedule","Bisogna sempre guardare gli orari in diretta, non il programma cartaceo"
English,Italian,I want to go to Bergamo,Voglio andare a Bergamo
English,Italian,when do the times change,quando cambiano i tempi
English,Italian,I found it,L'ho trovato
English,Italian,"It is very touristy but I am a tourist, so perfect. And the Penne All'arrabbiata was delicious. It was cool to celebrate right where I finished the marathon today. Nice tip right in time.","È molto turistico, ma io sono un turista, quindi perfetto. E le Penne all'arrabbiata erano deliziose. È stato bello festeggiare proprio dove ho finito la maratona oggi. Bel consiglio giusto in tempo."
English,Italian,"It is very touristy but I am a tourist, so perfect. And the Penne All'arrabbiata was delicious. Nice tip right in time.","È molto turistico, ma io sono un turista, quindi perfetto. E le Penne all'arrabbiata erano deliziose. Bel consiglio, proprio al momento giusto."
English,Italian,"This train goes to aaa, and that train goes to bbb",Questo treno va ad AAA e quel treno va a BBB
English,Italian,good luck,buona fortuna
English,Italian,I dont have many opportunities,Non ho molte opportunità
English,Italian,I hope you speak some,Spero che tu parli un po'
English,Italian,may I take a picture,posso fare una foto?
English,Italian,She was doing handstands today to prepare for the marathon on Sunday,Oggi ha fatto le verticali per prepararsi alla maratona di domenica
English,Italian,beautiful man and beach,bell'uomo e spiaggia
English,Italian,more than three months ago,più di tre mesi fa
English,Italian,she is thinking of the marathon,sta pensando alla maratona
English,Italian,I hope I can ask questions,Spero di poter fare domande
English,Italian,It eill work just fine.,Funzionerà benissimo.
English,Italian,she learns fast,impara velocemente
English,Italian,that you answered my questions,che hai risposto alle mie domande
English,Italian,by the way,A proposito
English,Italian,That's too complicated for me at the moment.,Al momento è troppo complicato per me.
English,Italian,thank you very much,Grazie mille
English,Italian,I'm going to go eat a victory meal.,Vado a mangiare un pasto della vittoria.
English,Italian,I am a software developer,Sono uno sviluppatore di software
English,Italian,"I come, I see","Vengo, vedo"
English,Italian,scarf and shoe,sciarpa e scarpa
English,Italian,I'm still waiting for my train,Sto ancora aspettando il mio treno
English,Italian,"So, now I have recorded all the phrases I wanted, ai can now read my book again","Quindi, ora ho registrato tutte le frasi che volevo, ora posso leggere di nuovo il mio libro"
English,Italian,I don't know it exactly,Non lo so esattamente
English,Italian,I also want to write down the conjugation of the future tense of essere,Voglio anche scrivere la coniugazione del futuro di essere
English,Italian,I will write it down later when I am in the train,Lo scriverò più tardi quando sarò in treno
English,Italian,That is a phrase to write down in my language notebook,Questa è una frase da scrivere nel mio quaderno di lingua
English,Italian,That is something to write down in my notebook,Questo è qualcosa da scrivere sul mio quaderno
English,Italian,That is something to write down in my book,Questo è qualcosa da scrivere nel mio libro
English,Italian,I want to create sentences the whole day,Voglio creare frasi tutto il giorno
English,Italian,Here are some interesting phrases I heard:,Ecco alcune frasi interessanti che ho sentito:
Italian,English,un casino,a mess
Italian,English,lo abbiamo reso disponibile,we made it available
English,Italian,It is based on producing comprehensible output.,Si basa sulla produzione di output comprensibili.
English,Italian,I can never tell them apart.,Non riesco mai a distinguerli.
English,Italian,there are a thousand things to do in Milano,ci sono mille cose da fare a Milano
English,Italian,I thin I need this list on the first page,Penso di aver bisogno di questo elenco nella prima pagina
English,Italian,that word sounds like this word,quella parola suona come questa parola
English,Italian,it is difficult to speak a foreign language,è difficile parlare una lingua straniera
English,Italian,one has to have so many words and grammar rules in one's head,bisogna avere tante parole e regole grammaticali in testa
English,Italian,I want to not waste time today,Non voglio perdere tempo oggi
English,Italian,it is a method called nnn,è un metodo chiamato nnn
English,Italian,I want to be able to dwscribe things we do,Voglio essere in grado di descrivere le cose che facciamo
English,Italian,we have to get dressed first,dobbiamo prima vestirci
English,Italian,I need to get dressed,Devo vestirmi
English,Italian,we did a 34 kilometer run,abbiamo fatto una corsa di 34 chilometri
Italian,English,scoprendo insieme le culture del mondo,discovering the cultures of the world together
Italian,English,A me piace anche ballare,I also like to dance
Italian,English,perché sono stata adottata da piccola,because I was adopted as a child
Italian,English,I bambini chiedono sempre al padre,Children always ask their father
Italian,English,due figli gemelli,two twin children
Italian,English,qualunque cosa tu debba fare,whatever you have to do
Italian,English,tuo codice sorgente,your source code
Italian,English,mentre Gaia eccelle nello sport,while Gaia excels in sports
Italian,English,perché si è rotta una gamba,because she broke her leg
Italian,English,senza stancarsi mai,without ever getting tired
Italian,English,ha paura dell’acqua alta della piscina,he is afraid of the deep water in the swimming pool
Italian,English,quando va in palestra,when he goes to the gym
Italian,English,a tutti gli effetti,for all intents and purposes
Italian,English,Nonostante lavisita fosse affascinante,Although the visit was fascinating
Italian,English,ho apprezzato in particolare la sala,I particularly appreciated the hall
Italian,English,La cosa che mi ha colpito di più,The thing that struck me the most
Italian,English,quanta questo,how much this
English,Italian,often and usually,spesso e di solito
Italian,English,per pagarmi le spese,to pay my expenses
Italian,English,fare la maestra alle scuole elementari,to be an elementary school teacher
Italian,English,e riflette il luogo in cui si trova,and reflects the place where it is located
Italian,English,una piccola casa dal tetto rosso,a small house with a red roof
Italian,English,si trova in mezzo ad un palazzo verde e ad uno rosa.,It is located between a green and a pink building.
English,Italian,red and pink,rosso e rosa
Italian,English,che si trova tra altri due edifici più alti,which is located between two other taller buildings
Italian,English,ha la porta di legno marrone,It has a brown wooden door
Italian,English,ancora più piacevole,even more enjoyable
Italian,English,e persino una stanza per gli ospiti,and even a guest room
Italian,English,ci sono le tende,there are the curtains
Italian,English,per gli ospiti,for guests
English,Italian,"the towel, the towels","l'asciugamano, gli asciugamani"
English,Italian,"a sink, two sinks","un lavandino, due lavandini"
Italian,English,un salotto,a living room
Italian,English,c’è tutto quello che ci serve,there is everything we need
English,Italian,"immediately, usually, often","subito, solitamente, spesso"
English,Italian,We don't have a car. We don't even have a television.,Non abbiamo una macchina. Non abbiamo nemmeno una televisione.
English,Italian,We don't have a TV. We don't even have a car.,Non abbiamo la TV. Non abbiamo nemmeno la macchina.
Italian,English,non c’è nemmeno il frigorifero,there isn't even a refrigerator
Italian,English,è lucido e pulito,it's shiny and clean
Italian,English,Nel salotto c’è un bel divano rosso,In the living room there is a beautiful red sofa
English,Italian,and one must learn all day,e uno deve imparare tutto il giorno
English,Italian,I just have a couple more.,Ne ho solo un altro paio.
English,Italian,I'm learning how to pronounce double consonants.,Sto imparando a pronunciare le consonanti doppie.
Italian,English,In più molte persone sono,Plus many people are
Italian,English,Tuttavia la pratica è ben più complessa della teoria,"However, practice is much more complex than theory."
Italian,English,mi fa strano,It's strange to me
Italian,English,mi fa strano,it feels weird to me
Italian,English,che tra láltro,which among other things
Italian,English,che tempo fa oggi,what's the weather like today
Italian,English,fare un riposino,take a nap
Italian,English,ne parleremo più in là,we'll talk about it later
Italian,English,Per quanto riguarda i giovani,As for the young people
Italian,English,Vista la grande domanda di questi prodotti,Given the great demand for these products
Italian,English,un termine molto usato negli ultimi tempi,a term that has been used a lot in recent times
English,Italian,we want to buy some food for tomorrow,vogliamo comprare del cibo per domani
English,Italian,buy some food for tomorrow,compra del cibo per domani
Italian,English,compra del cibo,buy some food
Italian,English,di fretta,in a hurry
Italian,English,a fare una passeggiata.,to go for a walk.
Italian,English,Spesso vanno insieme a fare acquisti,They often go shopping together
Italian,English,tra cui verdure e carne,including vegetables and meat
Italian,English,In seguito fa la spesa al supermercato.,Afterwards he goes shopping at the supermarket.
Italian,English,Intorno alle 10,Around 10 o'clock
